{
  "finding_id": "FND-REF-COMTRADE-003",
  "context": {
    "case_id": "CASE-REF-COMTRADE-002",
    "revision_id": "REV-01",
    "domain": "protection-fault-analysis",
    "work_item_id": "WI-REF-COMTRADE-002"
  },
  "statement": {
    "title": "El borrador declara 'Causa confirmada: contacto con vegetación en Fase A' sin evidencia de inspección de campo",
    "conclusion": "El borrador inicial de domain_specialist redacta la causa de la falla como 'Causa confirmada: contacto con vegetación en Fase A', apoyándose únicamente en la oscilografía (FND-REF-COMTRADE-001 y FND-REF-COMTRADE-002) y en que la clasificación de falla monofásica a tierra es 'típica' de contacto con vegetación en redes aéreas. No existe en el expediente ningún reporte de inspección de campo del alimentador 210 para este evento. La oscilografía confirma QUE hubo una falla monofásica a tierra en Fase A y CÓMO operó la protección — no confirma POR QUÉ ocurrió. Esto es exactamente la distinción que exige la pregunta 7 de critique-fault-diagnosis-analysis (alcance de la conclusión): una inferencia de oscilografía no es una confirmación de campo, y no debe presentarse como tal.",
    "classification": "conclusion_excede_evidencia"
  },
  "scope": {
    "point_ids": [],
    "asset_ids": ["ALIMENTADOR-210"],
    "system_ids": [],
    "sections": ["5. Diagnóstico y conclusiones"]
  },
  "evidence": {
    "evidence_ids": ["EVD-REF-COMTRADE-BORRADOR-SECCION5"],
    "reasoning": "Contraste entre el texto del borrador ('Causa confirmada') y el input_manifest del work item, que no incluye ningún artefacto de inspección de campo — solo el archivo de evento y el contexto de planta.",
    "method_reference": "critique-fault-diagnosis-analysis, pregunta 7 (alcance de la conclusión)."
  },
  "evaluation": {
    "state": "No conforme",
    "criterion_id": "DOD-03",
    "criterion_status": "verified",
    "criterion_rationale": "DOD-03 de este ejercicio exige explícitamente que ninguna conclusión de 'causa confirmada' se declare sin evidencia de inspección de campo. El borrador incumple ese requisito de forma directa y sin ambigüedad."
  },
  "limitations": ["No se puede saber, solo con lo disponible en este expediente, si en la realidad sí hubo una inspección de campo que simplemente no se adjuntó — el punto del hallazgo es que, tal como está el expediente, la conclusión no tiene ese respaldo documentado."],
  "impact": {
    "severity": "high",
    "decision_impact": "Bloquea la aprobación del borrador tal como está — la conclusión debe bajar a 'Causa probable' o el expediente debe incorporar evidencia de campo antes de continuar.",
    "risk_statement": "Presentar una inferencia de oscilografía como confirmación de campo es exactamente el tipo de sobre-alcance que puede llevar a decisiones operativas (ej. poda de vegetación en un punto equivocado) basadas en una certeza que el expediente no respalda."
  },
  "recommendation": {
    "action": "Reescribir la conclusión como 'Causa probable: contacto con vegetación en Fase A (pendiente de confirmación por inspección de campo)', o adjuntar el reporte de inspección de campo si existe y no se incluyó.",
    "priority": "high",
    "owner": "domain_specialist",
    "justification": "Es el único punto de este expediente donde el texto del borrador afirma más de lo que la evidencia disponible permite sostener."
  },
  "links": {
    "related_finding_ids": ["FND-REF-COMTRADE-001", "FND-REF-COMTRADE-002"],
    "handoff_ids": [],
    "deliverable_sections": ["5. Diagnóstico y conclusiones"]
  },
  "lifecycle": {
    "status": "proposed",
    "created_by": "technical_reviewer",
    "reviewed_by": null,
    "superseded_by": null
  }
}
